{
  "schema": "rie.audience_policy.v1",
  "policy_id": "aud.child_7_10.stress.v1",
  "audience_band": "child_7_10",
  "label": "Child Safe Stress Policy",
  "require_provenance": true,
  "require_institutional_or_publisher_anchor": true,
  "allow_community_sources": false,
  "allow_video_platforms": true,
  "allow_warning_labeled_results": false,
  "allow_quarantined_results": false,
  "deny_for_answer_like_patterns": true,
  "max_results_per_domain": 3,
  "min_trust_signal_count": 1
}
